### ISSUE TITLE
Netbird operator does not work when cilium+kubeproxy replacement is active

### ISSUE THREAD

**Issue by bornav** [netbirdio/kubernetes-operator#215]
When installing netbird operator on a cluster that does not have default kube scheduler, netbird operator deploys routers and resources to the netbird-api plane successfuly, assigns network and matches the resource to the domain, but after manually adding the policy when trying to access the resource it fails with error `ERR_CONNECTION_TIMED_OUT`

for testing i tried it on a selhosted instance and the publicly available one, both result in same behavior

i can easily reproduce this by deploying it in a kind cluster, i provided 3 scripts for deploying it normally with default cni, with cilium without kube proxy replacement, and cilium with kube proxy replacement

in this repo https://github.com/bornav/cluster-playground/tree/main/netbird-operator you can find 3 deploy scripts 

deploy.sh (cilium cni, with kube proxy replaced)                             # broken
deploy-normal.sh (normal cni)                                                            # working
deploy-cilium-w-proxy.sh (cilium cni, with default kube proxy) # working

just running the script locally should give a reproduced example, assuming netbird/secret.yaml is populated

cleanup would be just a matter of running cleanup.sh

i dont see any errors on operator/networkrouters that would be related to this

policy that is manually created

<img width="1575" height="247" alt="Image" src="https://github.com/user-attachments/assets/f73f40df-5181-4638-bf67-cbf52ec1114b" />

resource assigned but not actually accessible

<img width="1079" height="275" alt="Image" src="https://github.com/user-attachments/assets/d422c2f4-b0bf-47a3-b8d4-c53059b99643" />

**Comment by knordum** [comment]
Can confirm we also experience the same issue when using Cilium with `kubeProxyReplacement: true`.

In our case the NetBird operator reconciles successfully and the network router becomes Ready, but traffic through the NetBird-routed resource does not seem to go through.

**Comment by phillebaba** [comment]
My best guess without having looked into this yet is that the iptables setup by the netbird client does not play well with the kube proxy replacement that circumvents the need for iptables/nftables/ipvs. I have experienced other issues with running Cilium without kube proxy in the past as other projects assume that the networking stack functions in a specific manner.

I have some other work that needs to be completed first before I can dig into figuring out where things are going wrong. I can assume that this will take some work to trace. If anyone else has does end up trying to figure out where packets are dropped please do share what you find!

**Comment by bornav** [comment]
@phillebaba i did a quick pcap of it and shat it into llm and here is what it came up with 

<img width="934" height="989" alt="Image" src="https://github.com/user-attachments/assets/7df9774a-f1b0-4381-944d-708e7fcc92c0" />

The packets are being dropped between the DNAT step and the pod delivery. With Cilium replacing kube-proxy:

 - Standard iptables DNAT/SNAT rules for Service port forwarding exist (that's why we see the DNAT)
 - But Cilium uses eBPF-based L7/L4 proxying instead of iptables for actual packet forwarding
 - Cilium's eBPF programs likely don't recognize the DNAT'd UDP packets as belonging to a Service endpoint, so they drop them
 - TCP traffic to kube-apiserver works because it goes through Cilium's own proxy handling on lo



not sure how much i would trust this but had no time to manually investigate the pcap, but ill provide it here

[dumpfile.tar.gz](https://github.com/user-attachments/files/27245386/dumpfile.tar.gz)

i have attached the pcap of it, this is from the example above that is broken if it helps

**Comment by Kariton** [comment]
i do run cilium with `kubeProxyReplacement: true` and native routing with `bpf.datapathMode: netkit` + `bpf.masquerade: true` successfully.
ive setup `NetworkRouter` and a `NetworkResource` that points to an envoy-gateway service.

works as expected in my PoC.

then ive created some netbird reverse-proxy entries that point to that netbird resource and pass the host header down to that resource.

also "internal" (other peers; mesh), via netbird dns, where ive created CNAME records for my NetworkRouter domain records that point to the service.
- NetworkRouter: cluster.example.com (operator managed)
  - envoy.envoy-external.cluster.example.com -> netbird resource
- new zone: example.com (manually created)
  - cname X.example.com -> envoy.envoy-external.cluster.example.com

only downside with other peers is the router nat which prevents me from keeping the real ips from clients. (100.64.0.0/10 subnet ip)
instead ill get the NAT address from my cluster internal netbird router container. (as expected; as documented)
just need to figure out how to setup `SidecarProfile` (which crashes due to user permissions and ro-fs etc.)
or another way to make _that_ work as expected.

most relevant cilium values in my deployment:
```yaml
    k8sServiceHost: 127.0.0.1
    k8sServicePort: 6443

    kubeProxyReplacement: true
    kubeProxyReplacementHealthzBindAddr: 0.0.0.0:10256

    ipam:
      mode: kubernetes

    ipv6:
      enabled: true

    devices: bond+

    # Cilium routing for inter-nodes pod traffic
    routingMode: native
    autoDirectNodeRoutes: true
    directRoutingSkipUnreachable: true
    localRedirectPolicies:
      enabled: true
    ipv4NativeRoutingCIDR: 10.244.0.0/16
    ipv6NativeRoutingCIDR: fd00:10:244::/64
    loadBalancer:
      acceleration: best-effort
      algorithm: maglev
      mode: hybrid

    k8s:
      requireIPv4PodCIDR: true
      requireIPv6PodCIDR: true

    bgpControlPlane:
      enabled: true
      routerIDAllocation:
        mode: ip-pool
        ipPool: 10.244.0.0/24

    ciliumEndpointSlice:
      enabled: true

    # expected to become default - soonTM; https://github.com/cilium/cilium/issues/14955
    endpointRoutes:
      enabled: true

    bandwidthManager:
      enabled: true
      bbr: true

    bpf:
      datapathMode: netkit
      masquerade: true

    enableIPv6BIGTCP: true
    enableIPv4BIGTCP: true
    bpfClockProbe: true

    socketLB:
      enabled: true
      hostNamespaceOnly: true
```

**Comment by bornav** [comment]
@Kariton after doing A B testing only thing that made a diff was
```

socketLB:
  enabled: true
  hostNamespaceOnly: true
```

**Comment by bornav** [comment]
@phillebaba considering it's fixable via cilium value change i would consider this as fixed

**Comment by phillebaba** [comment]
I am going to reopen the issue because I think that we should document the required configuration before closing.

**Comment by christianhuth** [comment]
For my environment setting 

```yaml
socketLB:
  enabled: true
  hostNamespaceOnly: true
```

didn't fix the problem. Still looking for a solution. See this issue as well: https://github.com/netbirdio/kubernetes-operator/issues/284

**Comment by phillebaba** [comment]
@christianhuth could we keep the discussion here if your issue is related to Cilium kube-proxy replacement. Makes it easier for me to track context and to keep information concentrated.

If not we can keep looking at things in #284.

**Comment by christianhuth** [comment]
@phillebaba: Sure. But I don't think the socketLB nor the kubeProxyReplacement is the real problem. I have a local kind cluster running with kubeProxyReplacement and without socketLB and netbird works just fine. I can share the code for that environment if it helps you.

**Comment by bornav** [comment]
@christianhuth in my case i had local rke2 cluster, could it since it's running under docker for you?
Id still say it's an issue, but to try to narrow it down

**Comment by christianhuth** [comment]
@bornav: yeah something is definitely strange. But hard to debug to be honest. How did you do your pcap that you mentioned?

**Comment by bornav** [comment]
> [@bornav](https://github.com/bornav): yeah something is definitely strange. But hard to debug to be honest. How did you do your pcap that you mentioned?

tcpdump on the host on specific interface, and in the cilium pod, then compare packets

**Comment by christianhuth** [comment]
> > 
> 
> tcpdump on the host on specific interface, and in the cilium pod, then compare packets

on which host? The one running the pods of the target app? Or the one running the networkrouter-pod?

**Comment by christianhuth** [comment]
So what I can confirm so far. My VMs running the NetworkRouter Pods (as well as the physical servers that run these VMs) get traffic on udp port 51820 from my laptop.

I scaled the deployment of the NetworkRouter to one Pod to simplify debugging. For my ArgoCD service with the ClusterIP of 10.100.26.110 I can see this in the Logs of the NetworkRouter Pod:

```bash
2026-06-08T13:28:12.433Z DEBG client/firewall/nftables/router_linux.go:472: added route rule: sources=[100.125.144.183/32], destination=10.100.26.110/32, proto=all, sPort=<nil>, dPort=<nil>, action=accept
2026-06-08T13:28:12.433Z DEBG client/firewall/nftables/router_linux.go:472: added route rule: sources=[100.125.194.21/32], destination=10.100.26.110/32, proto=tcp, sPort=<nil>, dPort=range:80,80, action=accept
2026-06-08T13:28:12.434Z DEBG client/firewall/nftables/router_linux.go:472: added route rule: sources=[100.125.61.224/32], destination=10.100.26.110/32, proto=tcp, sPort=<nil>, dPort=range:80,80, action=accept
```

The first line is the source ip of my laptop peer in Netbird. The other ips? I have no clue.

Furthermore I created a debug-Pod for the NetworkRouter Pod:

```bash
kubectl debug -it pod/networkrouter-6fc7cd9cfc-dz6hs --image=nicolaka/netshoot --target=netbird --profile=netadmin
```

I can see this nftables rulset:

```bash
nft list ruleset   
table ip netbird {
        chain netbird-rt-fwd {
                ct state established,related counter packets 0 bytes 0 accept
                ip saddr 100.125.144.183 ip daddr 10.100.26.110 counter packets 0 bytes 0 accept
                ip saddr 100.125.61.224 ip daddr 10.100.26.110 tcp dport 80-80 counter packets 0 bytes 0 accept
                ip saddr 100.125.194.21 ip daddr 10.100.26.110 tcp dport 80-80 counter packets 0 bytes 0 accept
        }

        chain netbird-rt-postrouting {
                type nat hook postrouting priority srcnat - 1; policy accept;
                meta mark 0x0001bd21 oifname != "lo" counter packets 0 bytes 0 masquerade
                meta mark 0x0001bd22 oifname "wt0" counter packets 0 bytes 0 masquerade
        }

        chain netbird-rt-redirect {
                type nat hook prerouting priority dstnat; policy accept;
        }

        chain netbird-mangle-postrouting {
                type filter hook postrouting priority mangle; policy accept;
                oifname "wt0" ct state new ct mark set 0x0001bd11
        }

        chain netbird-mangle-prerouting {
                type filter hook prerouting priority mangle; policy accept;
                iifname != "wt0" ct state new ip saddr 10.100.26.110 meta mark set 0x0001bd22
                iifname "wt0" ct state new ip daddr 10.100.26.110 meta mark set 0x0001bd21
                iifname "wt0" ct state new ct mark set 0x0001bd10
        }

        chain netbird-mangle-forward {
                type filter hook forward priority mangle; policy accept;
                oifname "wt0" tcp flags syn counter packets 0 bytes 0 tcp option maxseg size > 1240 tcp option maxseg size set 1240
        }

        chain netbird-acl-input-rules {
                ct state established,related counter packets 0 bytes 0 accept
        }

        chain netbird-acl-input-filter {
                type filter hook input priority filter; policy accept;
                iifname "wt0" jump netbird-acl-input-rules
                iifname "wt0" drop
        }

        chain netbird-acl-forward-filter {
                type filter hook forward priority filter; policy accept;
                meta mark 0x0001bd20 accept
                iifname "wt0" jump netbird-rt-fwd
                iifname "wt0" drop
        }

        chain netbird-raw-out {
                type filter hook output priority raw; policy accept;
        }

        chain netbird-raw-pre {
                type filter hook prerouting priority raw; policy accept;
        }
}
```

Inside the debug container I can see traffic happening:

```bash
tcpdump -ni any udp port 51820     
tcpdump: WARNING: any: That device doesn't support promiscuous mode
(Promiscuous mode not supported on the "any" device)
tcpdump: verbose output suppressed, use -v[v]... for full protocol decode
listening on any, link-type LINUX_SLL2 (Linux cooked v2), snapshot length 262144 bytes
13:30:49.801871 eth0  In  IP <my-public-ip>.57901 > 10.0.8.151.51820: UDP, length 184
13:30:49.804724 eth0  Out IP 10.0.8.151.51820 > <my-public-ip>.57901: UDP, length 184
13:30:49.804880 eth0  Out IP 10.0.8.151.51820 > <my-public-ip>.57901: UDP, length 136
13:30:49.821884 eth0  In  IP <my-public-ip>.57901 > 10.0.8.151.51820: UDP, length 136
13:30:49.821979 eth0  In  IP <my-public-ip>.57901 > 10.0.8.151.51820: UDP, length 184
13:30:49.822087 eth0  Out IP 10.0.8.151.51820 > <my-public-ip>.57901: UDP, length 136
13:30:51.802118 eth0  In  IP <my-public-ip>.57901 > 10.0.8.151.51820: UDP, length 184
13:30:51.802358 eth0  Out IP 10.0.8.151.51820 > <my-public-ip>.57901: UDP, length 136
13:30:51.805650 eth0  Out IP 10.0.8.151.51820 > <my-public-ip>.57901: UDP, length 184
13:30:51.822550 eth0  In  IP <my-public-ip>.57901 > 10.0.8.151.51820: UDP, length 136
13:30:51.822876 eth0  In  IP <my-public-ip>.57901 > 10.0.8.151.51820: UDP, length 184
13:30:51.823242 eth0  Out IP 10.0.8.151.51820 > <my-public-ip>.57901: UDP, length 136
13:30:53.803244 eth0  In  IP <my-public-ip>.57901 > 10.0.8.151.51820: UDP, length 184
13:30:53.803535 eth0  Out IP 10.0.8.151.51820 > <my-public-ip>.57901: UDP, length 136
13:30:53.805941 eth0  Out IP 10.0.8.151.51820 > <my-public-ip>.57901: UDP, length 184
13:30:53.823090 eth0  In  IP <my-public-ip>.57901 > 10.0.8.151.51820: UDP, length 136
13:30:53.823096 eth0  In  IP <my-public-ip>.57901 > 10.0.8.151.51820: UDP, length 184
13:30:53.823405 eth0  Out IP 10.0.8.151.51820 > <my-public-ip>.57901: UDP, length 136
13:30:55.803053 eth0  In  IP <my-public-ip>.57901 > 10.0.8.151.51820: UDP, length 184
13:30:55.803354 eth0  Out IP 10.0.8.151.51820 > <my-public-ip>.57901: UDP, length 136
13:30:55.806687 eth0  Out IP 10.0.8.151.51820 > <my-public-ip>.57901: UDP, length 184
13:30:55.823535 eth0  In  IP <my-public-ip>.57901 > 10.0.8.151.51820: UDP, length 136
13:30:55.823589 eth0  In  IP <my-public-ip>.57901 > 10.0.8.151.51820: UDP, length 184
13:30:55.823810 eth0  Out IP 10.0.8.151.51820 > <my-public-ip>.57901: UDP, length 136
13:30:57.804647 eth0  In  IP <my-public-ip>.57901 > 10.0.8.151.51820: UDP, length 184
13:30:57.804964 eth0  Out IP 10.0.8.151.51820 > <my-public-ip>.57901: UDP, length 136
13:30:57.807311 eth0  Out IP 10.0.8.151.51820 > <my-public-ip>.57901: UDP, length 184
13:30:57.824468 eth0  In  IP <my-public-ip>.57901 > 10.0.8.151.51820: UDP, length 136
13:30:57.824474 eth0  In  IP <my-public-ip>.57901 > 10.0.8.151.51820: UDP, length 184
13:30:57.824745 eth0  Out IP 10.0.8.151.51820 > <my-public-ip>.57901: UDP, length 136
13:30:59.435350 eth0  Out IP 10.0.8.151.51820 > 10.204.32.97.39810: UDP, length 184
13:30:59.435493 eth0  Out IP 10.0.8.151.51820 > 10.101.1.91.39810: UDP, length 184
13:30:59.435584 eth0  Out IP 10.0.8.151.51820 > 10.204.32.97.39810: UDP, length 184
13:30:59.435640 eth0  Out IP 10.0.8.151.51820 > 10.101.1.91.39810: UDP, length 184
13:30:59.448839 eth0  Out IP 10.0.8.151.51820 > 10.204.32.97.39810: UDP, length 184
13:30:59.448930 eth0  Out IP 10.0.8.151.51820 > 10.101.1.91.39810: UDP, length 184
13:30:59.449331 eth0  Out IP 10.0.8.151.51820 > 10.204.32.97.39810: UDP, length 184
13:30:59.449484 eth0  Out IP 10.0.8.151.51820 > 10.101.1.91.39810: UDP, length 184
13:30:59.457429 eth0  Out IP 10.0.8.151.51820 > 80.69.175.7.5555: UDP, length 20
13:30:59.465898 eth0  In  IP 80.69.175.7.5555 > 10.0.8.151.51820: UDP, length 40
13:30:59.650214 eth0  Out IP 10.0.8.151.51820 > 10.204.32.97.39810: UDP, length 184
13:30:59.650348 eth0  Out IP 10.0.8.151.51820 > 10.101.1.91.39810: UDP, length 184
13:30:59.650425 eth0  Out IP 10.0.8.151.51820 > 10.204.32.97.39810: UDP, length 184
13:30:59.650488 eth0  Out IP 10.0.8.151.51820 > 10.101.1.91.39810: UDP, length 184
13:30:59.804709 eth0  In  IP <my-public-ip>.57901 > 10.0.8.151.51820: UDP, length 184
13:30:59.805064 eth0  Out IP 10.0.8.151.51820 > <my-public-ip>.57901: UDP, length 136
13:30:59.808427 eth0  Out IP 10.0.8.151.51820 > <my-public-ip>.57901: UDP, length 184
13:30:59.825584 eth0  In  IP <my-public-ip>.57901 > 10.0.8.151.51820: UDP, length 136
13:30:59.825646 eth0  In  IP <my-public-ip>.57901 > 10.0.8.151.51820: UDP, length 184
13:30:59.825897 eth0  Out IP 10.0.8.151.51820 > <my-public-ip>.57901: UDP, length 136
13:30:59.851257 eth0  Out IP 10.0.8.151.51820 > 10.204.32.97.39810: UDP, length 184
13:30:59.851402 eth0  Out IP 10.0.8.151.51820 > 10.101.1.91.39810: UDP, length 184
13:30:59.851474 eth0  Out IP 10.0.8.151.51820 > 10.204.32.97.39810: UDP, length 184
13:30:59.851534 eth0  Out IP 10.0.8.151.51820 > 10.101.1.91.39810: UDP, length 184
```

In Hubble I can only see traffic from the networkrouter Pod to the public Internet (I assume these are some Netbird service like api.netbird.io, ...)

**Comment by christianhuth** [comment]
When using the same setup, but with Helm Chart v0.3.1 and the old way of exposing a Service through annotations I can access my service and also see the traffic flow in the debug container:

```bash
tcpdump -ni any host 10.98.49.136
tcpdump: WARNING: any: That device doesn't support promiscuous mode
(Promiscuous mode not supported on the "any" device)
tcpdump: verbose output suppressed, use -v[v]... for full protocol decode
listening on any, link-type LINUX_SLL2 (Linux cooked v2), snapshot length 262144 bytes
07:30:07.907982 eth0  Out IP 10.0.11.214.55780 > 10.98.49.136.80: Flags [S], seq 2840546048, win 64860, options [mss 1410,sackOK,TS val 3423304340 ecr 0,nop,wscale 7], length 0
07:30:07.908588 eth0  In  IP 10.98.49.136.80 > 10.0.11.214.55780: Flags [S.], seq 3227424155, ack 2840546049, win 64308, options [mss 1410,sackOK,TS val 184121543 ecr 3423304340,nop,wscale 7], length 0
07:30:07.908645 eth0  Out IP 10.0.11.214.55780 > 10.98.49.136.80: Flags [.], ack 1, win 507, options [nop,nop,TS val 3423304340 ecr 184121543], length 0
07:30:07.927845 eth0  Out IP 10.0.11.214.55780 > 10.98.49.136.80: Flags [P.], seq 1:456, ack 1, win 507, options [nop,nop,TS val 3423304360 ecr 184121543], length 455: HTTP: GET / HTTP/1.1
07:30:07.928243 eth0  In  IP 10.98.49.136.80 > 10.0.11.214.55780: Flags [.], ack 456, win 502, options [nop,nop,TS val 184121563 ecr 3423304360], length 0
07:30:07.928709 eth0  In  IP 10.98.49.136.80 > 10.0.11.214.55780: Flags [P.], seq 1:181, ack 456, win 502, options [nop,nop,TS val 184121563 ecr 3423304360], length 180: HTTP: HTTP/1.1 304 Not Modified
07:30:07.928731 eth0  Out IP 10.0.11.214.55780 > 10.98.49.136.80: Flags [.], ack 181, win 506, options [nop,nop,TS val 3423304360 ecr 184121563], length 0
07:30:09.684237 eth0  Out IP 10.0.11.214.55780 > 10.98.49.136.80: Flags [P.], seq 456:911, ack 181, win 506, options [nop,nop,TS val 3423306116 ecr 184121563], length 455: HTTP: GET / HTTP/1.1
07:30:09.685070 eth0  In  IP 10.98.49.136.80 > 10.0.11.214.55780: Flags [P.], seq 181:361, ack 911, win 502, options [nop,nop,TS val 184123320 ecr 3423306116], length 180: HTTP: HTTP/1.1 304 Not Modified
07:30:09.685094 eth0  Out IP 10.0.11.214.55780 > 10.98.49.136.80: Flags [.], ack 361, win 505, options [nop,nop,TS val 3423306117 ecr 184123320], length 0
07:30:24.689788 eth0  Out IP 10.0.11.214.55780 > 10.98.49.136.80: Flags [.], ack 361, win 505, options [nop,nop,TS val 3423321122 ecr 184123320], length 0
07:30:24.690391 eth0  In  IP 10.98.49.136.80 > 10.0.11.214.55780: Flags [.], ack 911, win 502, options [nop,nop,TS val 184138325 ecr 3423306117], length 0
07:30:39.885790 eth0  Out IP 10.0.11.214.55780 > 10.98.49.136.80: Flags [.], ack 361, win 505, options [nop,nop,TS val 3423336318 ecr 184138325], length 0
07:30:39.886647 eth0  In  IP 10.98.49.136.80 > 10.0.11.214.55780: Flags [.], ack 911, win 502, options [nop,nop,TS val 184153521 ecr 3423306117], length 0
07:30:54.989766 eth0  Out IP 10.0.11.214.55780 > 10.98.49.136.80: Flags [.], ack 361, win 505, options [nop,nop,TS val 3423351422 ecr 184153521], length 0
07:30:54.990470 eth0  In  IP 10.98.49.136.80 > 10.0.11.214.55780: Flags [.], ack 911, win 502, options [nop,nop,TS val 184168625 ecr 3423306117], length 0
07:31:10.093804 eth0  Out IP 10.0.11.214.55780 > 10.98.49.136.80: Flags [.], ack 361, win 505, options [nop,nop,TS val 3423366526 ecr 184168625], length 0
07:31:10.094470 eth0  In  IP 10.98.49.136.80 > 10.0.11.214.55780: Flags [.], ack 911, win 502, options [nop,nop,TS val 184183729 ecr 3423306117], length 0
07:31:14.731590 eth0  In  IP 10.98.49.136.80 > 10.0.11.214.55780: Flags [F.], seq 361, ack 911, win 502, options [nop,nop,TS val 184188366 ecr 3423306117], length 0
07:31:14.752170 eth0  Out IP 10.0.11.214.55780 > 10.98.49.136.80: Flags [F.], seq 911, ack 362, win 505, options [nop,nop,TS val 3423371184 ecr 184188366], length 0
07:31:14.752664 eth0  In  IP 10.98.49.136.80 > 10.0.11.214.55780: Flags [.], ack 912, win 502, options [nop,nop,TS val 184188388 ecr 3423371184], length 0
```

Every request to the exposed services also shows as a small peak in the tcpdump of the vm running the router pod:

```bash
tcpdump -ni any udp port 51820
tcpdump: data link type LINUX_SLL2
tcpdump: verbose output suppressed, use -v[v]... for full protocol decode
listening on any, link-type LINUX_SLL2 (Linux cooked v2), snapshot length 262144 bytes
09:34:19.178747 lxca29cf1035779 In  IP 10.0.11.214.51820 > 155.4.187.80.61882: UDP, length 184
09:34:19.196158 lxca29cf1035779 Out IP 155.4.187.80.61882 > 10.0.11.214.51820: UDP, length 136
09:34:19.196199 lxca29cf1035779 Out IP 155.4.187.80.61882 > 10.0.11.214.51820: UDP, length 184
09:34:19.196443 lxca29cf1035779 In  IP 10.0.11.214.51820 > 155.4.187.80.61882: UDP, length 136
09:34:20.276809 lxca29cf1035779 Out IP 155.4.187.80.61882 > 10.0.11.214.51820: UDP, length 128
09:34:20.278640 lxca29cf1035779 In  IP 10.0.11.214.51820 > 155.4.187.80.61882: UDP, length 176
# probably this line here with the increased length
09:34:20.278884 lxca29cf1035779 Out IP 155.4.187.80.61882 > 10.0.11.214.51820: UDP, length 528
09:34:20.279219 lxca29cf1035779 In  IP 10.0.11.214.51820 > 155.4.187.80.61882: UDP, length 80
09:34:20.279939 lxca29cf1035779 In  IP 10.0.11.214.51820 > 155.4.187.80.61882: UDP, length 256
09:34:20.297821 lxca29cf1035779 Out IP 155.4.187.80.61882 > 10.0.11.214.51820: UDP, length 128
09:34:20.299473 lxca29cf1035779 In  IP 10.0.11.214.51820 > 155.4.187.80.61882: UDP, length 176
09:34:20.318304 lxca29cf1035779 Out IP 155.4.187.80.61882 > 10.0.11.214.51820: UDP, length 128
09:34:20.321372 lxca29cf1035779 In  IP 10.0.11.214.51820 > 155.4.187.80.61882: UDP, length 128
09:34:20.341294 lxca29cf1035779 Out IP 155.4.187.80.61882 > 10.0.11.214.51820: UDP, length 80
09:34:20.950799 lxca29cf1035779 Out IP 155.4.187.80.61882 > 10.0.11.214.51820: UDP, length 184
09:34:20.951074 lxca29cf1035779 In  IP 10.0.11.214.51820 > 155.4.187.80.61882: UDP, length 136
# probably this line here with the increased length
09:34:21.015266 lxca29cf1035779 Out IP 155.4.187.80.61882 > 10.0.11.214.51820: UDP, length 528
09:34:21.015703 lxca29cf1035779 In  IP 10.0.11.214.51820 > 155.4.187.80.61882: UDP, length 80
09:34:21.017663 lxca29cf1035779 In  IP 10.0.11.214.51820 > 155.4.187.80.61882: UDP, length 256
09:34:21.083166 lxca29cf1035779 Out IP 155.4.187.80.61882 > 10.0.11.214.51820: UDP, length 80
09:34:21.179786 lxca29cf1035779 In  IP 10.0.11.214.51820 > 155.4.187.80.61882: UDP, length 184
09:34:21.196884 lxca29cf1035779 Out IP 155.4.187.80.61882 > 10.0.11.214.51820: UDP, length 136
09:34:21.196894 lxca29cf1035779 Out IP 155.4.187.80.61882 > 10.0.11.214.51820: UDP, length 184
09:34:21.197166 lxca29cf1035779 In  IP 10.0.11.214.51820 > 155.4.187.80.61882: UDP, length 136
```

This is different from what I can see when using the newer version of the Chart and the CRD-based approach.

**Comment by christianhuth** [comment]
Okay my ingress problems seems to be solved by simply switching from the rootless Image to the normal one. I can now access my ClusterIP service through IP, DNS and Reverse Proxy.

According to the docs this should have worked with the rooless-Image as well:

```bash
rootless is well supported and works without any privileges. However, it will only be useful for inbound access or as routing peer (no outbound connections except via socks proxy)
```

**Comment by christianhuth** [comment]
TL;DR; After upgrading to Cilium Helm Chart v1.19.4 I experienced the "no-ingress-connectivity problem" again, but was able to solve it like mentioned by @bornav by setting:

```yaml
socketLB:
  enabled: true
  hostNamespaceOnly: true
```

### What I found:

- On Cilium 1.18.4, this worked out of the box — Hubble shows the forwarded SYN correctly resolved and DNAT'd to the backend pod (`to-overlay`/`to-network FORWARDED`), full handshake completes.
- On Cilium 1.19.4, the identical setup breaks — the forwarded SYN shows up in Hubble as `world`/`to-stack FORWARDED` with the original ClusterIP destination (no DNAT applied), and the connection times out with SYN retransmits. No drop events anywhere (`hubble observe --verdict DROPPED, cilium-dbg monitor --type drop` — nothing).
- Notably, curl from inside the same router pod to the same ClusterIP works fine on 1.19.4 (`to-endpoint FORWARDED`, correct backend) — so this is specific to forwarded/re-NAT'd traffic from within the pod's own netns, not ClusterIP resolution in general.
- `cilium-dbg bpf lb list` shows the correct LB map entry with a real backend (`10.99.117.44:80/TCP (1) -> 10.0.1.160:8080/TCP)` present and unchanged on both 1.18.4, 1.19.4-broken, and 1.19.4-with-the-socketLB-fix. So this doesn't look like a map-population issue — the correct entry is always there, but on 1.19.4 with `socketLB` disabled, the datapath program handling this forwarded traffic doesn't seem to consult it.

### Fix:

setting

```yaml
socketLB:
  enabled: true
  hostNamespaceOnly: true
```

resolved it for us on 1.19.4 without needing to downgrade. After applying it, the `bpf lb list` output is unchanged (same entries, including the 1.19 `[ClusterIP, non-routable]` wildcard entries) — so whatever changed is in which eBPF program/code path gets exercised for this traffic, not the LB map contents.

This looks like it could be a real Cilium 1.19.x regression specific to "forward + SNAT to a ClusterIP from within a pod's own netns" with `kubeProxyReplacement: true` and `socketLB` not enabled — which is exactly NetBird's NetworkRouter pattern. Happy to provide full Hubble captures / configs if useful for a Cilium-side report.
